{
  "compiler_sha256": "91b0662c44d286ad5caa6864e9a0d5c24007e966fe83e208d59b4f96c58dc6e5",
  "generation": 1,
  "lock_sha256": "4faedde3b471e4b4999e50517bbdb5fa39283dbe8fad0017a446f8429511e6cb",
  "plugins": [
    {
      "manifest_sha256": "853308c81065601af84726d28879218979f87374d4d3e526de5afbe2c7448bfe",
      "plugin_id": "code-change",
      "resources": [
        {
          "id": "code-change.readme",
          "kind": "file",
          "path": "plugins/code-change/README.md",
          "sha256": "6946a38c6f6db8826450f21302f0e6e467b80e48709c76f604018a2dfd45d4f0"
        }
      ],
      "version": "1.0.0"
    }
  ],
  "record_type": "plugin-lock",
  "schema_version": 1
}
