{
  "compiler_sha256": "91b0662c44d286ad5caa6864e9a0d5c24007e966fe83e208d59b4f96c58dc6e5",
  "generation": 1,
  "lock_sha256": "ca31e55edad2bc273ab1c5225a2bd97ba6a713b1afc7abcc39e1f0b56a85f658",
  "plugins": [
    {
      "manifest_sha256": "312d2cfe4e54eca5efa267ae2e4ab35e6112505edbfc3c0071613b5780c0a4d1",
      "plugin_id": "decisions",
      "resources": [
        {
          "id": "decisions.mutation-equivalence",
          "kind": "file",
          "path": "plugins/decisions/questions/mutation-equivalence.json",
          "sha256": "e4d9ce1adeb5d61296b0606964c38f809e11faacc0b84f1c68b2001ae67ba92f"
        },
        {
          "id": "decisions.readme",
          "kind": "file",
          "path": "plugins/decisions/README.md",
          "sha256": "f2fb26a42c3ce43f726941e0f3aca4612cfb2aeb5e8084d0d4358b170c97c5c9"
        },
        {
          "id": "decisions.report-screen",
          "kind": "file",
          "path": "plugins/decisions/questions/report-screen.json",
          "sha256": "a7de4ac53d19acd6977a453ce5efe3f477506d4fed689d5bf0021484c8540511"
        },
        {
          "id": "decisions.run-health",
          "kind": "file",
          "path": "plugins/decisions/questions/run-health.json",
          "sha256": "655bd2d59039e188478687cfb5ad607eb3c330c4b2f8ba8f70f32db56839df85"
        }
      ],
      "version": "1.0.0"
    }
  ],
  "record_type": "plugin-lock",
  "schema_version": 1
}
